{
  "version": 1,
  "markup": "Strings may use inline Markdown: **bold**, *italics* and `code`. Placeholders are {name}.",
  "opening": {
    "title": "Before we start, let's get to know each other.",
    "body": [
      "A few questions so your AI can work *with* you, not just for you. About 8 minutes."
    ],
    "privacy": {
      "page": "Skip anything. Your answers stay on this device. Nothing is sent anywhere.",
      "agent": "Skip anything. Your answers go to the AI tool you're using, like any message you send it. What it saves is your profile, in this folder, and you can read and change it."
    },
    "privacy_rule": "Show `page` on the interview web page, where nothing leaves the browser. Show `agent` when an AI runs the interview.",
    "button": "Begin"
  },
  "chapters": [
    { "id": "starting", "number": 1, "title": "Where you're starting" },
    { "id": "here-for", "number": 2, "title": "What you're here for" },
    { "id": "think-with-you", "number": 3, "title": "How it should think with you" },
    {
      "id": "spot-the-problem",
      "number": 4,
      "title": "Spot the problem",
      "intro": {
        "title": "Three quick scenes.",
        "body": "Each shows something an AI said. What would you do? This isn't a test. It's the most useful habit you'll build with AI."
      },
      "skip_label": "Skip this chapter",
      "mirror": {
        "maps_to": "profile.coaching.validation",
        "validation": { "0": "high", "1": "high", "2": "medium", "3": "light" },
        "lines": [
          { "caught": [3], "text": "None of these got past you. That habit is rare, and your companion will build on it." },
          { "caught": [1, 2], "text": "{scene} is the one to watch for. It slips past most people, and we'll practise it." },
          { "caught": [0], "text": "These slip past most people at first. That's why your companion will show its evidence, and why the guide starts here." }
        ],
        "scene_rule": "{scene} is the name of the first scene they missed, in chapter order.",
        "extra": {
          "when": { "trust_now_min": 4, "caught_max": 1 },
          "text": "Earlier you said you usually take answers as they are. That's worth changing, and it's easier than it sounds."
        }
      }
    },
    { "id": "boundaries", "number": 5, "title": "Boundaries" }
  ],
  "questions": [
    {
      "id": "name",
      "chapter": 1,
      "type": "text",
      "prompt": "What should your AI call you?",
      "why": "small, but it changes how the conversation feels.",
      "maps_to": "profile.name",
      "branch": "all",
      "optional": true
    },
    {
      "id": "language",
      "chapter": 1,
      "type": "single",
      "prompt": "Which language should it reply in?",
      "options": [
        { "id": "en", "label": "English", "value": "English" },
        { "id": "bn", "label": "বাংলা (Bangla)", "value": "Bangla" },
        { "id": "es", "label": "Español", "value": "Spanish" },
        { "id": "hi", "label": "हिन्दी (Hindi)", "value": "Hindi" },
        { "id": "other", "label": "Other", "value": "other", "other_text": true }
      ],
      "why": "you think best in the language you're most comfortable in. Code and commands stay as they are.",
      "maps_to": "profile.language",
      "branch": "all",
      "optional": true
    },
    {
      "id": "tools",
      "chapter": 1,
      "type": "multi",
      "prompt": "Which AI do you use most?",
      "options": [
        { "id": "chatgpt", "label": "ChatGPT", "value": "chatgpt" },
        { "id": "claude", "label": "Claude", "value": "claude" },
        { "id": "gemini", "label": "Gemini", "value": "gemini" },
        { "id": "copilot", "label": "Copilot", "value": "copilot" },
        { "id": "other", "label": "Something else", "value": "other", "other_text": true },
        { "id": "none", "label": "I haven't really used one yet", "value": "none", "exclusive": true }
      ],
      "why": "to show you the setup that fits what you already have.",
      "maps_to": "profile.tools",
      "branch": "all",
      "optional": true
    },
    {
      "id": "usage_now",
      "chapter": 1,
      "type": "multi",
      "prompt": "What do you use it for today?",
      "options": [
        { "id": "questions", "label": "Quick questions", "value": "questions" },
        { "id": "writing", "label": "Writing", "value": "writing" },
        { "id": "studying", "label": "Studying", "value": "studying" },
        { "id": "code", "label": "Writing code", "value": "code" },
        { "id": "apps", "label": "Building whole apps by prompting", "value": "apps" },
        { "id": "not-much", "label": "Not much yet", "value": "not-much", "exclusive": true }
      ],
      "why": "so we start from where you are, not from zero.",
      "maps_to": "profile.usage_now",
      "branch": "all",
      "optional": true
    },
    {
      "id": "trust_now",
      "chapter": 1,
      "type": "scale",
      "prompt": "When your AI gives you an answer, how much do you check it?",
      "scale": { "min": 1, "max": 5, "min_label": "I check almost everything", "max_label": "I usually take it as it is" },
      "why": "there's no right answer here. We'll come back to this in chapter 4.",
      "maps_to": "profile.trust_self_report",
      "branch": "all",
      "optional": true
    },
    {
      "id": "code_level",
      "chapter": 1,
      "type": "single",
      "prompt": "Where are you with code?",
      "options": [
        { "id": "none", "label": "I've never written any", "value": "none" },
        { "id": "tutorials", "label": "I've followed tutorials", "value": "tutorials" },
        { "id": "small", "label": "I can build small things on my own", "value": "small" },
        { "id": "regular", "label": "I write code regularly (study or work)", "value": "regular" }
      ],
      "why": "it sets how much your AI explains and which words it can assume you know.",
      "maps_to": "profile.code_level",
      "branch": "all",
      "optional": true
    },
    {
      "id": "path",
      "chapter": 2,
      "type": "single",
      "prompt": "What do you want your AI to help with most?",
      "options": [
        { "id": "learn", "label": "**Learn:** understand what I'm studying", "value": "learn",
          "echo": "Good. We'll aim for understanding that sticks, not answers that don't." },
        { "id": "build", "label": "**Build:** make something real (an app, a site, a tool)", "value": "build",
          "echo": "Good. We'll aim for things you can explain, not just things that run." },
        { "id": "both", "label": "**Both**", "value": "both",
          "echo": "Good. We'll keep the two modes separate so each gets the right habits." }
      ],
      "why": "learning and building need different habits from your AI.",
      "maps_to": "profile.path",
      "branch": "all",
      "optional": true
    },
    {
      "id": "study_level",
      "chapter": 2,
      "type": "single",
      "prompt": "What are you studying?",
      "options": [
        { "id": "school", "label": "School", "value": "school" },
        { "id": "university", "label": "University", "value": "university" },
        { "id": "course", "label": "A course or bootcamp", "value": "course" },
        { "id": "self", "label": "On my own", "value": "self" },
        { "id": "job", "label": "For my job", "value": "job" }
      ],
      "text_field": { "placeholder": "Subject, e.g. \"Operating systems\"", "maps_to": "profile.learn.subjects", "list": true },
      "why": "explanations should match your level and subject.",
      "maps_to": "profile.learn.level",
      "branch": "learn",
      "in_both": true,
      "optional": true
    },
    {
      "id": "learn_style",
      "chapter": 2,
      "type": "single",
      "prompt": "When you meet a new idea, what helps most?",
      "options": [
        { "id": "example-first", "label": "An example first, then the theory", "value": "example-first" },
        { "id": "big-picture", "label": "The big picture first, then details", "value": "big-picture" },
        { "id": "problems", "label": "Trying problems straight away", "value": "problems" },
        { "id": "explain-back", "label": "Explaining it back in my own words", "value": "explain-back" }
      ],
      "why": "your AI will lead with this and still mix in the others. Mixing is what makes learning stick.",
      "maps_to": "profile.learn.style",
      "branch": "learn",
      "in_both": false,
      "optional": true
    },
    {
      "id": "graded_work",
      "chapter": 2,
      "type": "single",
      "prompt": "Will you use it for anything that's graded (assignments, take-home exams)?",
      "options": [
        { "id": "yes", "label": "Yes", "value": "yes" },
        { "id": "sometimes", "label": "Sometimes", "value": "sometimes" },
        { "id": "no", "label": "No", "value": "no" }
      ],
      "why": "for graded work your AI will help you understand and check your own attempt, but won't write the answer you hand in. That protects you, and it's how you actually learn it.",
      "maps_to": "profile.learn.graded_work",
      "branch": "learn",
      "in_both": true,
      "optional": true
    },
    {
      "id": "deadline",
      "chapter": 2,
      "type": "date",
      "prompt": "Any exam or deadline coming up?",
      "why": "so practice can be spaced out before the date, not crammed.",
      "maps_to": "profile.learn.deadlines",
      "list": true,
      "branch": "learn",
      "in_both": true,
      "optional": true
    },
    {
      "id": "build_what",
      "chapter": 2,
      "type": "text",
      "prompt": "What do you want to build?",
      "chips": ["A portfolio site", "A tool for my work", "An app idea I have", "I just want to learn by building"],
      "chips_note": "A chip fills the text box. They can edit it after.",
      "why": "your first project shapes everything else, so it helps to start with something you care about.",